ID,Tags,Text
374,,"The doctor and the nursing assistant and reception, thanks for a very professional service last Sunday when I attended with a chest infection"
373,,"The nurse and doctor were efficient, friendly and reassuring and also charming.  They explained everything about their diagnosis, treatment."
372,,All the staff were caring and considerate.
371,Check-in,Brilliant experience in outpatient dept. No waiting.
370,Facilities, All areas of the hospital I saw were clean and tidy.
369,Facilities,Nice gardens with lot of space
368,Check-in,"everyone was friendly even had tea and biscuits while waited,"
367,Check-in," My appointment proceeded on time, and I was not kept waiting unduly at any point during my visit. "
366,,"I was very well treated by all of the staff who looked after me on my recent visit to the Outpatients Department for a respiratory problem.  They were very kind, courteous and helpful.  "
365,Facilities,Clean toilets.
364,,Very helpful staff.
363,Facilities,The clinic appears to be clean and well maintained.
362,Check-in,Each time I make an appointment I later receive a cancellation and a new appointment made. This has happened 5 times in the last two years. each time there is a further delay of one - two months. The appointment booking system here is a joke.
361,Facilities,Modern bright surroundings
360,Check-in,Seen very quickly didnt have to wait long in waiting room.
359,,"the staff were helpful, friendly, competent."
358,"Care,Staff",The care given by all the nurses was very supportive and I felt confident in all treatments and advice given.   The surgeon came to see me personally re postponement and then again after my surgery. 
357,, From the nurses to the doctor everyone treated me with respect and kept me informed as to my treatment.
356,Care,I can't fault the care I had as an inpatient (or as an outpatient during investigation) at this inspirational hospital.
355,,Staff was amazing and was treated with so much respect.
354,Facilities,The Day Surgery Unit is clean and ordered.
353,,All staff I spoke to were very helpful and polite. The nurse practicioner I saw for a colposcopy explained everything thoroughly and was very kind and reassuring.
352,Facilities,Hospital was very clean.
351,,"Sympathetic treatment by nurses in the early pregnancy diagnostic unit after my miscarriage. Two nurses were professional and sympathetic, and put me at ease during my scan."
350,Facilities,Radiology department and ECG department were clean. A&E department was not clean. Some part of hospital is modern compare to other part.
349,,the doctors and staff to be kind and caring
348,,"We encountered 3 nurses, the receptionist, a radiographer and a doctor, all of whom were not only quick workers (who obviously knew what they were doing) but also friendly, ready with a smile to make us feel at ease."
347,Care, I have always found the care to be excellent .
346,Facilities,The cafeteria is an excellent facility
345,,The staff who dealt with me in the clinic were very helpful and supportive.
344,Facilities, It goes without saying the facilities are amazing.
343,Care,the care was fantastic.
342,Care, I felt really cared for. I think I had the best experience possible
341,,"the midwives were superb - kind, patient, supportive."
340,,"The Consultant, Surgeon, Doctors and the Oncology department as a whole (including front desk staff) were clear, helpful, kind and understanding, as well as offering excellent medical practice."
339,Facilities,the hospital was clean.
338,Facilities,Used to be quick and on time with Blue Badge parking available  now will not address no blue badge parking blaming . Having clinical trial with third of people disabled if go up in scooter there will be health & safety issues - fire .
337,"Check-in,Staff",The receptionist was rude when I complained and said I would have to wait 3 weeks for a new appointment
336,Care,"The care - there were several times when people took more trouble with me than they strictly needed to - coming up to the ward to see how I was getting on, for example. "
335,Care,"I was treated by the A&E Dept for a broken toe. I had a wait for an X-Ray and then for treatment.I was asked whether I wanted an injection for local anaesthetic, but advised that it was not recommended, as there is a risk of infection - this involved me in the treatment and was good"
334,,"The staff (doctors and nurses) were exceptionally helpful and kind, giving up their own spare time to ensure my wife could get scans done quickly and save her discomfort & stress."
333,Facilities,The out-patients area was very clean and tidy.
332,,There staff and doctors were all very helpful towards him and very professional.  
331,Facilities,"The cardiac ward, is spacious, light and state-of-the-art. "
330,Care,"My treatment was both kind and vigilant, which is exactly what a worried, unwell person needs. "
329,"Staff,Care","Staff were professional and respectful, provided high standard of care in three departments."
328,Care,she had a complete examination there.
327,,The radiographer was very through and explained what he was doing during the whole procedure.
326,,All the staff involved were professional and courteous.
325,Care,My six month old son received excellent care at the Paediatric Ophthalmology Clinic. 
324,Check-in,Appointments on time.
323,,Staff friendly
322,,The courtesy and professionalism of all staff and the care and dedication of all involved in the midwifery team.
321,,How convincing the staff were that they knew what they were talking about
320,, The food wasn't great though - a bit hit and miss.
319,Facilities,The ward was cleaned several times daily
318,Care,The patient care and professionalism.
317,,the staff and doctors were kind caring and courteous and very hard working.
316,,"Even with the lack of staff and resource to their disposal they are always willing to help, give advice and try to give the best care possible."
315,,"The diabetic clinic staff, under staffed and over worked but always ready to help"
314,Check-in,"Seen quickly in A&E, monitored and discharded home all in 2-3 hours, after being knocked out."
313,Check-in,There is nothing I liked at all I waited THREE  hours to be seen. 
312,,Most of the staff where very nice and helpful.
311,Facilities,The whole place was incredibly clean and easy to get around
310,,The food is excellent and there is a good choice.
309,Care,The only bad point about my care medically speaking was that they never gave me any information about the drugs I was receiving. I had numerous tablets placed in front of me and was expected to take them without any questions asked. 
308,Check-in,"I had an appointment for an x-ray and although it was very busy, the system was very efficient, as quick as possible."
304,, They treat you with respect and compassion at what can be a confusing time. Everthing is explained to you and the open evening is a very good idea. I'm very grateful to the team for the help they have given us.
303,Care,"I was on 'ambulatory care' of the new QE hospital. Just had a minor procedure, "
302,Care,I  have been very happy with the care that I have received there. 
301,,"I spent a few hours at the Early Pregancy Unit today, and found all members of staff who I came into contact with extremely pleasant, kind and welcoming. They were clearly really busy and running late impacting on the clinical staff's lunch break, but this did not affect their professionalism or attitudes; I was really impressed."
300,,Friendly efficient staff in the Haematology Clinic.
298,Check-in,On arrival at the ENT reception I was quickly attended to and shown where to sit to await the Dr.
297,,When I was finally admitted for my surgery the nursing staff and my new consultant were wonderful.
296,Check-in,I did not have to wait for very long.
295,,The doctor was thorough.
294,,I  thought the domestic staff and ward housekeeper were kind and friendly. They worked hard but still had time for a kind word especially when I was upset. One of the nurses on the ward was also very caring. The porters were nice and made conversation.
293,Check-in,The waiting time in ENT out patients was rather lengthy.
292,"Check-in,Facilities",waiting area had plenty of seats
291, Facilities,"I was a patient in Maternity Unit. The Unit was clean, and the food was quite good."
289,Check-in,Waiting time was short.
288,,Staff courteous. 
287,,All staff were very professional
286,Check-in,"There was not too long a queue at the check in desk.  The receptionist noted my appointment time on my file, on the sheet related to that appointment."
285,Staff, The staff where very good and polite and they looked after me and treated me like everyone else and not just like a child even though I am 23 yrs old.
284,,the quality of the food needs to be looked at.
283,Staff,"Some of the midwives leave a lot to be desired, some even seem as if they cannot be bothered."
282,Staff,"I received surgery from an outstanding surgeon and assistants all the staff i had contact with were pleasant kind and cheerful they helped me through a very worrying time and I am very grateful to them, thank you all very much."
281,Staff, The staff where very good and polite and they looked after me and treated me like everyone else and not just like a child even though I am 23 yrs old.
280,Staff,"Everyone the cleaners, secretaries, nurses the surgeons were fantastic! Well done is all I can say."
279,Care,The care and treatment I was given was exceptional.
278,Staff,"The Doctor's, Midwives, Nurses and all other staff are fantastic, and should extremely proud of them selves"
277,Care,The level of professionalism and care at the QE's maternity unit is exceptional.
276,Care,I have felt that treatment is focused on me and that everything possible is being done to support me and treat me thoroughly - including support for my family. I love this unit!
275,Check-in,the quick admission to A&E via ambulance
274,Facilities,"The ward I was on was maternity and it was swarming with wood lice, not a very enjoyable experience at all."
273,Staff,some of the staff had a very abrubt manner.
272,,The hospital food was horrible.
271,Care, I was ushered through to a treatment room where I was overwhelmed with care and attention.  From that moment on I was subject to some of the best treatment anyone could ever want to receive. 
270,"Staff,Care","The speed and efficiency of the nurse who first assessed me on arrival at the QE Hospital was second to none.  The Doctors and Nurses were absolutely brilliant, I was treated with dignity and respect and was informed on a regular basis as to what treatment I would be receiving. "
269,Care,I have always been treated as a whole person they do not just look after your Liver. 
268,Staff,The surgical team were excellent and I am very grateful for the skilled person I was treated by.  The TRAINED nurses were also skilled and seemed professional.
266,Staff,catering staff on ward 14a were very friendly and helpful
265,Staff,Everybody on the ward was very helpfull and knew exactly how to help each person.
264,Facilities, The unit is very well organised and clean !
263,Staff,The nurses and doctors were very nice and easy to talk to.
262,Facilities,The facilities were clean.
261,Staff,"Staff were kind, helpful and professional."
260,Care, The level of information I was getting on handling treatment appeared to be people i came across undergoing cancer treatment at other hospitals.
259,," I must also commend the hospital food, it was exceptionally good considering it is made for the masses I was really impressed and the kitchen  need to be recognised for this."
258,Staff,The staff were fantastic so caring and professional and they listened to what you wanted to say. nurses and auxilery staff were really nice and professional.  In ICU the staff were special they were uplifting and nothing was too much trouble for them the should be commended.  This may sound strange but
257,Staff,The Medical Secretaries are always polite and helpful when contacted.
256,"Care,Staff",My operation was carried out with efficiency by highly skilled people - except for a trainee anaesthetist who messed-up a vein.
255,"Care,Staff","i was very grateful for the treatment i had, special thanks to the consultants and a nurse on west ward."
254,"Staff,Care",the staff were there for not just me but my family i know i could have died at any time and I'm now going home.
253,Care,straight forward treatment
252,Staff,The staff were amazing and took into account my nervousness both at being kept in overnight and the procedure being carried out on my heart
251,Staff,All staff very pleasant and friendly which puts you at ease.
250,Facilities,Hospital is more like a hotel and the waiting pods area is immaculate. 
249,Staff,"Both the nurses and the consultants that dealt with me were excellent, as were the anesthetists. thank you!"
248,"Staff,Care","I was extremely pleased to be allowed to return home, as the staff on the ward had not taken details of my medication and returning home enabled me to recommence medication as prescribed"
247,Facilities, the hospital was spotless whilst i was there and still is. 
246,Check-in,Generally waiting time was short....
245,Staff,PALS were helpful and staff in small cafe were always pleasant and helpful.
244,Care,I just grin and bear it and thank goodness that the treatment is good even if the experience is usually awful.
243,"Staff,Care","My dad had a major brain operation and when i went to visit him he was always being looked after, the nurses were very friendly and helped with any questions"
242,Staff,"We admired the  professional, considerate and kind way in  which my daughter and our family were treated. In particular the Consultants regularly kept us informed, the junior doctors were friendly and efficient and the nursing staff were beyond reproach, sympathetic and kind."
241,Staff,The Doctors were very understanding and helpful when they were there.
240,Staff,I was seen by the consultant straight away. He fully explained my diagnostic tests that I am to under go and what will happen during the tests. The nurses on duty were very helpful as were the reception staff.
239,Staff,"I was seen straight away the staff were kind, efficient and professional."
238,Staff,"Friendly, if somewhat harrassed staff"
237,Check-in,"I can only agree with the previous statement regarding blood tests.  I have tried three times to go and have a blood test in my dinner hour.  I can't understand why it should take so long.  For example the unit at xx General, you are rarely waiting more than 15/20 mins.  whereas yy you could be there over an hour, or more."
236,Facilities,The departmenr was maintained and cleaned to the highest standard. Thankyou
235,Staff,All the staff were great.  They made my stay really easy for me and my family.
234,Care,"She was diagnosed only 9 weeks before she passed away When we were told that she could not be operated on and that she was going to die, she was moved to be closer to home."
233,Care,"Quick, efficient, good medical advice."
232,"Staff,Care",I think the staff and receptionist was very friendly and they dealt with my injury in a postive manner and they made sure i was ok every few minutes.
231,"Care,Facilities","My mother was an in patient under the care of the doctor,.for rehabilitation following surgery. Her treatment was exemplary and the ward was spotless. "
230,"Care, ","I would especially commend the nurses in the Hospital who looked after me during a long wait on 1/7/09 for an ambulance car, keeping making calls to the service on my behalf and providing me with emergency diabetic food."
229,Staff,i would like too thank the nursin staff and doctors for their care and commitment in lookin after me during my operation once again thankyou
228,Staff," I was put at ease by the friendly and efficient way the doctor and nurses dealt with me. I cannot thank them enough for their help.  I know that they are trained professionals, but the way that a friendly bedside manner was used to put me at ease makes all the difference."
227,Care,I was referred to the physio department at the Hospital by my GP after a fall affected my upper arm. The treatment i received was excellent and very helpful in curing the problem.
226,Staff,The staff were all very efficient and pleasant and put patients at their ease.
225,Care,As a health professional myself I have only praise for the care I received at this hospital. It helped me recover from a stroke in body mind and spirit. The whole ethos of the hospital was caring.
224,Care,He felt that most of the time he was being cared for in a very kind and professional way.
223,, really liked the good food!
222,Care,Uncle cared for with dignity.
221,Facilities,"Beautiful, clean hospital . "
220,Care,Leaving after a 5 day ordeal with average care
219,,I had to be careful during the ten days I spent there as the food was so good I could have put on weight.
218,Care," I have had a number of minor operations requiring an overnight stay and have always found it to be the same, whichever ward I was on."
217,, the meals were good
216,Staff,all the staff  were very friendly helpful
214,"Care,Staff",the consultant was particularly good and kept me informed throughout  (broken wrist). I received great care
213,,Nice meals a really good experience
212,Care,Excellent care . 
211,,the food was alot better from when i was in last time more on the menu for diabetics
210,,"The food was better than I expected, better than the resteruant."
209,Staff,Hospital staff were polite to me.
207,Staff,The consultant even called fropm home at the end of her shift to check on my progress and came to see me the following morning after I had given birth. All the staff were friendly and honest.
206,Staff,i was on ward 17 and i would really like to praise the nurses and doctors and healthcare assistants as they really helped me and made me feel as comfortable as possible.
205,"Staff,Care","the consultant was very friendly and approachable, keeping us fully informed of treatment options and asking if we had any questions. The treatment was very good."
204,Check-in,"The reception were extremely helpful, friendly and accomodating"
203,Check-in,A staff member visited us at our home to help us deal with the multitude of form filling which we were trying to cope with.
201,Staff,Helpful office staff.
200,Staff,Doctor was friendly good environment
198,Check-in,It took me a week to get hold of someone at the hospital on the phone.  I am a busy person and do not have the time to wait on the end of a phone until it rings out.  This issue needs to be addressed.
197,Staff,"The nurses were lovely on my ward. They sat with me, spoke with me and sometimes even had a minute to play with me. "
196,Staff,"Every single member of staff, whether in a medical or non-medical role always have a smile.Staff treat my child wonderfully and even though they must treat thousands of children."
195,Facilities,"the hospital, it was clean,and well organised and i will definately recommend the hospital to anyone"
194,"Care,Check-in","Today i brought my son in to be treated for a broken arm, we were called in pretty much straight away, and the service given to us was exceptional."
193,Staff,i liked the staff cos they are nice and all the time it is clean
192,Facilities,I thought the wards were clean and well managed
191,Staff,"whilst on ward 7 the atmosphere was good.   It felt as though all the staff cared about youand were really caring.   I would not feel anxious if I had to return there,"
190,Care," the care was fantastic, and the doctors and nurses professional, friendly and importantly fixed me up. "
189,Check-in,"The worst encounter was with a nurse on triage, who misunderstood us a few times. The nurse was not as patient as they could have been, when someone is ill enough to enter outpatients in great pain at 7.00am it is not helped by an uncaring attitude"
188,Check-in,On my admission to hospital i was put at ease and my operation was fully explained
187,"Check-in,Care",Triage was effective and I was even offered pain relief.
186,Care,The one-to-one care that we received from our midwife was exemplary even though the Labour Ward seemed terribly under-staffed at the time of our visit.
185,Care,The care I received was very professional and could not be faulted.
184,Staff,My wife was a cancer patient and found that most of the staff are excelent.
183,Staff,A very competent team who excelled at every opportunity
182,Care,"Couldn't fault any aspect of care that attended the birth of mine and my partner's son. Very happy with all aspect of care, mid-wife great, anaesthetist promptly available. After birth care far exceeded expectations."
181,Staff,"The staff were all friendly, efficient and in my opinion, overworked. I have a great respect for their dedication."
180,Care,Extra care was given on the maternity ward to support breast feeding and becoming a new mum.
179,Staff,All midwives and student midwives that handled my care did so with professionalism and ensured I understood every process and option open to both myself and my husband.
178,Staff, It was a difficult time for our family but the staff recognised this and supported us wonderfully.  Our special thanks to the ward sister who was a star!
177,Care,"The standard of treatment she received was exemplary but, just as important, she was cared for with great compassion, dignity and respect at all times."
176,"Staff,Care",I am under constant care of the haematology department which is headed by the consultant who in my opinion is an outstanding member of the staff.
175,Check-in,We were very impressed with the waiting time for appointments and the waiting times whilst at the hospital.
174,Staff,"The food was excellent apart from 1st night I was there I had a not very nice cheese sandwich but on the whole, fantastic 3 day stay, fantastic staff and really nice food."
173,Staff,I was made to feel relaxed and the nurses and doctors just could not do enough for me then after the operation I was put on to ward 14 and the staff were brilliant and I could not fault them. 
172,Facilities,The facilities were magnificent and clean.
171,"Staff,Care","Without exception each member of staff regardless of role did their best to explain everything clearly to us, and to keep us as calm and happy as possible throughout our stay.  We were made to feel that we could ask anything about our son s treatment and care, and that if it mattered to us, it certainly mattered to the staff."
170,Check-in, I was processed quickly via triage to a ward where all necessary emergency proceedures were performed efficiently.
169,, the food was good. No-one could possibly ask for more.
168,Staff,"Excellent care from Maternity staff - including consultant (and team), surgical staff who delivered both our sons via c-section and all nursing/supportstaff who helped with stay in hospital"
167,Care,My wife and I would like to put on record our gratitude for the excellent and professional care when I was admitted.
166,"Staff,Care","I was dealt with kindly by the staff and doctors who were honest with me most of the time. The gynae doctor on the night shift, I can't remember his name but he sorted me out straight away and seemed to know what he was doing."
165,Care,"Admitted on the morning of Saturday 12th September with abdominal pain and receiving a quick and, in my opinion, brilliant diagnosis, I had a gangrenous appendix removed on the same evening, and enjoyed nothing but the very best of treatment until I left 5 days later. "
164,Staff,i was a patient on the childrens and the staff there were really nice
163,Check-in,he missed the coach home and the receptionist phoned for a taxi to take him and his friend.
162,Staff," The Staff at A&E through to the X-Ray, doctors, nurses and all in the childrens ward were fantastic."
161,Facilities, Having heard horror stories about food and hygiene I was surprised at how good the food tasted and how clean the wards were. I am not easily pleased but I must give credit where it is due.
160,Staff," My mother was always treated with dignity and respect and whenever I asked the staff for any help or information it was always given with a smile.   I was never made to feel that I was a nuisance, on the contrary I always felt that everyone had my mother's best interests at heart and that they really cared for her and wanted to do a good job."
159,Staff,My wife and I were with her for 12 hours a day for six days and found ALL the staff very considerate to her and also to us during our stay by her bedside.
158,Care, The care and attention she received was excellent. She was kept clean and comfortable during the period.  
157,"Care, Staff","I was admitted with chest pains and weakness, which was diagnosed as Pneumonia, the care and treatment were second to none ,the staff whos care i was in (wards 15 and 2) were lovely, caring, and very professional, and i was back home in two days ,thankyou all."
156,Care,My father was neglected most of the time sent home without all that had been promised in place . I will be making an official complaint along with my brothers ref the neglect of an Abingdon born elderly gentleman .
155,Facilities, The Hospital grounds are stunning and the hospital itself is of a incredible high standard.
154,"Staff,Care","A lack of communication between Consultant and Nursing staff, led to me having to read my own notes to find out what had been done  during  my operation.  This is due to the nursing staff not being able to read the consultants notes, and then stating I would have to ask the consultant myself 6 weeks later at my follow  up appointment."
153,Staff,"the food was lovely,my consultant is a nice guy very thorough"
